<?xml version="1.0" encoding="UTF-8"?>
<prop_set xmlns="https://uwlib-cams.github.io/map_storage/xsd/"
          xmlns:xsi="http://www.w3.org/2001/XMLSchema-instance"
          xmlns:xs="http://www.w3.org/2001/XMLSchema"
          xmlns:rdf="http://www.w3.org/1999/02/22-rdf-syntax-ns#"
          xmlns:reg="http://metadataregistry.org/uri/profile/regap/"
          xmlns:rdfs="http://www.w3.org/2000/01/rdf-schema#"
          xmlns:uwmaps="https://uwlib-cams.github.io/map_storage/xsd/"
          xmlns:uwsinopia="https://uwlib-cams.github.io/sinopia_maps/xsd/"
          xmlns:dcam="http://purl.org/dc/dcam/"
          xmlns:prov="http://www.w3.org/ns/prov#"
          xmlns:owl="http://www.w3.org/2002/07/owl#"
          xsi:schemaLocation="https://uwlib-cams.github.io/map_storage/xsd/ https://uwlib-cams.github.io/map_storage/xsd/prop_set.xsd">
   <prop_set_label>rdaExtension</prop_set_label>
   <prop localid_prop="uwmaps_rdaExtension_prop_d12e130">
      <prop_iri iri="https://doi.org/10.6069/uwlib.55.d.4#hasCreatorCharacteristic"/>
      <prop_label xml:lang="en"/>
   </prop>
   <prop localid_prop="uwmaps_rdaExtension_prop_d12e164">
      <prop_iri iri="https://doi.org/10.6069/uwlib.55.d.4#hasContributorAgent"/>
      <prop_label xml:lang="en"/>
   </prop>
   <prop localid_prop="uwmaps_rdaExtension_prop_d12e193">
      <prop_iri iri="https://doi.org/10.6069/uwlib.55.d.4#hasUniversityOfWashingtonNote"/>
      <prop_label xml:lang="en"/>
   </prop>
   <prop localid_prop="uwmaps_rdaExtension_prop_d12e227">
      <prop_iri iri="https://doi.org/10.6069/uwlib.55.d.4#heldBy"/>
      <prop_label xml:lang="en"/>
   </prop>
   <prop localid_prop="uwmaps_rdaExtension_prop_d12e255">
      <prop_iri iri="https://doi.org/10.6069/uwlib.55.d.4#hasLcClassificationPartA"/>
      <prop_label xml:lang="en"/>
   </prop>
   <prop localid_prop="uwmaps_rdaExtension_prop_d12e289">
      <prop_iri iri="https://doi.org/10.6069/uwlib.55.d.4#hasLcClassificationPartB"/>
      <prop_label xml:lang="en"/>
   </prop>
   <prop localid_prop="uwmaps_rdaExtension_prop_d12e323">
      <prop_iri iri="https://doi.org/10.6069/uwlib.55.d.4#hasNlmClassificationPartA"/>
      <prop_label xml:lang="en"/>
   </prop>
   <prop localid_prop="uwmaps_rdaExtension_prop_d12e357">
      <prop_iri iri="https://doi.org/10.6069/uwlib.55.d.4#hasNlmClassificationPartB"/>
      <prop_label xml:lang="en"/>
   </prop>
   <prop localid_prop="uwmaps_rdaExtension_prop_d12e391">
      <prop_iri iri="https://doi.org/10.6069/uwlib.55.d.4#hasLcGeographicClassification"/>
      <prop_label xml:lang="en"/>
   </prop>
   <prop localid_prop="uwmaps_rdaExtension_prop_d12e425">
      <prop_iri iri="https://doi.org/10.6069/uwlib.55.d.4#hasSuDocClassificationNumber"/>
      <prop_label xml:lang="en"/>
   </prop>
   <prop localid_prop="uwmaps_rdaExtension_prop_d12e459">
      <prop_iri iri="https://doi.org/10.6069/uwlib.55.d.4#hasPhysicalLocation"/>
      <prop_label xml:lang="en"/>
   </prop>
   <prop localid_prop="uwmaps_rdaExtension_prop_d12e499">
      <prop_iri iri="https://doi.org/10.6069/uwlib.55.d.4#hasPhysicalSubLocation"/>
      <prop_label xml:lang="en"/>
   </prop>
   <prop localid_prop="uwmaps_rdaExtension_prop_d12e538">
      <prop_iri iri="https://doi.org/10.6069/uwlib.55.d.4#hasBarcode"/>
      <prop_label xml:lang="en"/>
   </prop>
   <prop localid_prop="uwmaps_rdaExtension_prop_d12e577">
      <prop_iri iri="https://doi.org/10.6069/uwlib.55.d.4#hasCallNumber"/>
      <prop_label xml:lang="en"/>
   </prop>
</prop_set>
